　	7:54	官邸着　官邸の敷地内を散歩
	9:09	藤井健志官房副長官補、木原稔総理大臣補佐官、和泉洋人総理大臣補佐官と面会（～9:15）
	9:16	木原総理大臣補佐官と面会（～9:18）
	9:27	西村康稔経済再生担当大臣、和泉総理大臣補佐官、内閣府の田和宏事務次官、井上裕之内閣府審議官、林幸宏政策統括官、村瀬佳史政策統括官と面会（～9:48）
	10:02	閣議（～10:08）
	10:09	麻生太郎副総理兼財務大臣と面会（～10:11）
	10:12	茂木敏充外務大臣と面会（～10:13）
	10:26	地球温暖化対策推進本部（～10:45）
	11:13	官邸発
	11:16	自民党本部着
	11:17	自民党の二階俊博幹事長、林幹雄幹事長代理と面会（～11:30）
	11:34	自民党臨時役員会開始
	11:40	自民党臨時役員会途中退席
	11:41	同所発
	11:45	官邸着
	12:25	武田良太総務大臣と面会（～12:38）
	12:39	河野太郎規制改革担当大臣と面会（～12:46）
	13:06	報道各社のインタビュー（～13:08）
	13:59	平井卓也デジタル大臣、デジタル庁の石倉洋子デジタル監、赤石浩一デジタル審議官と面会（～14:12）
	14:29	ＩＰＣ＝国際パラリンピック委員会のパーソンズ会長の表敬　東京オリンピック・パラリンピック組織委員会の橋本聖子会長、丸川珠代オリンピック・パラリンピック担当大臣ら同席（～14:42）
	16:01	経済財政諮問会議（～16:28）
	16:35	小泉進次郎環境大臣と面会（～16:55）
	18:02	官邸発
	18:04	衆議院第二議員会館着
	18:16	萩生田光一文部科学大臣と面会（～18:23）
	18:41	同所発
	18:48	東京・赤坂の衆議院議員宿舎着
9/2	7:52	東京・赤坂の衆議院議員宿舎発
	7:55	官邸着、敷地内を散歩
	10:00	山崎重孝内閣官房参与に辞令交付(～10:10)
	10:15	小泉進次郎環境大臣、和泉洋人総理大臣補佐官、経済産業省の奈須野太産業技術環境局長、環境省の小野洋地球環境局長と面会(～10:33)
	10:34	小泉環境大臣と面会(～11:09)
	11:10	和泉総理大臣補佐官、内閣官房の新原浩朗成長戦略会議事務局長代理と面会(～11:23)
	11:30	秋葉剛男国家安全保障局長、滝澤裕昭内閣情報官、外務省の岡野正敬総合外交政策局長、防衛省の増田和夫防衛政策局長、鈴木康彦統合幕僚副長と面会(～11:46)
	11:58	公明党の山口那津男代表と会食（～12:39)
	13:54	萩生田光一文部科学大臣、文部科学省の藤原誠事務次官と面会(～14:30)
	14:31	梶山弘志経済産業大臣、経済産業省の多田明弘事務次官、保坂伸資源エネルギー庁長官と面会(～14:45)
	14:46	梶山経済産業大臣と面会(～14:48)
	15:02	成長戦略会議(～15:41)
	15:50	官邸発
	15:53	自民党本部着
	15:54	自民党の二階俊博幹事長と面会(～16:10)
	16:11	同所発
	16:13	官邸着
	16:39	国際電気通信連合(ITU)の次期電気通信標準化局長選挙候補者の尾上誠蔵氏と面会、武田良太総務大臣ら同席(～16:53)
	17:01	気候変動対策推進のための有識者会議(～18:00)
	18:08	藤井健志官房副長官補、和泉総理大臣補佐官、内閣官房の吉田学新型コロナウイルス感染症対策推進室長、厚生労働省の樽見英樹事務次官、福島靖正医務技監と面会(～18:32)
	19:04	官邸発
	19:06	衆議院第二議員会館着
	19:52	同所発
	19:57	東京・赤坂の衆議院議員宿舎着
9/1	7:51	東京・赤坂の衆議院議員宿舎発
	7:55	公邸着
	8:02	参集訓練のため徒歩で公邸発
	8:03	官邸着
	8:28	総合防災訓練の第1回緊急災害対策本部会議　横浜市の山中竹春市長とテレビ会議（～8:53）
	9:00	同訓練の記者会見（～9:03）
	9:25	報道各社のインタビュー（～9:28）
	10:11	平井卓也デジタル改革担当大臣と面会　加藤勝信官房長官同席（～10:20）
	10:34	小泉進次郎環境大臣と面会（～11:07）
	13:00	平井卓也デジタル大臣、石倉洋子デジタル監と面会（～13:13）
	13:47	官邸発
	13:57	皇居着　内奏、内閣府の藤井比早之副大臣のデジタル副大臣認証式
	14:38	皇居発
	14:45	官邸着
	15:18	平井氏にデジタル大臣の補職辞令、内閣府の岡下昌平政務官にデジタル政務官の辞令交付　記念撮影（～15:22）
	16:00	デジタル庁発足式にテレビ会議方式で出席、訓示（～16:05）
	16:30	内閣官房気候変動対策推進室の新川浩嗣室長、赤堀毅、山下隆一両次長と面会（～16:38）
	16:50	内閣府の田和宏、山崎重孝新旧事務次官と面会（～16:55）
	16:56	外務省の森美樹夫領事局長、藤井健志官房副長官補と面会（～17:08）
	17:54	官邸発
	17:57	衆議院第二議員会館着
	18:05	自民党の山口泰明選対委員長と面会（～18:34）
	18:43	同所発
	18:48	東京・赤坂の衆議院議員宿舎着
