"2020-11-30T06:43:00"	"東京・赤坂の衆院議員宿舎発"
"2020-11-30T06:46:00"	"官邸着、敷地内を散歩"
"2020-11-30T07:24:00"	"官邸発"
"2020-11-30T07:28:00"	"東京・虎ノ門のホテル「The Okura Tokyo」着。同ホテル内のレストラン「オーキッド」で、フジテレビの反町理報道局解説委員長と会食 | ○"
"2020-11-30T08:31:00"	"同ホテル発"
"2020-11-30T08:40:00"	"官邸着"
"2020-11-30T10:45:00"	"自民党の地方創生実行統合本部の河村建夫本部長、山口俊一本部長代行、片山さつき顧問ら（～10:58）"
"2020-11-30T11:12:00"	"経済協力開発機構（OECD）条約署名60周年記念式典、国連の特別総会などに向けたビデオメッセージ収録（～11:29）"
"2020-11-30T11:30:00"	"梶山弘志経済産業大臣、経産省の安藤久佳事務次官、荒井勝喜総括審議官、資源エネルギー庁の飯田祐二次長、和泉洋人首相補佐官（～11:49）"
"2020-11-30T11:50:00"	"自民党の下村博文政調会長らから経済政策に関する提言書受け取り（～11:59）"
"2020-11-30T12:48:00"	"官邸発"
"2020-11-30T12:50:00"	"国会着"
"2020-11-30T12:51:00"	"参院議長応接室"
"2020-11-30T12:57:00"	"同室を出て、参院本会議場"
"2020-11-30T13:01:00"	"参院本会議開会"
"2020-11-30T15:22:00"	"参院本会議を途中退席し、国会発"
"2020-11-30T15:24:00"	"衆院第２議員会館着"
"2020-11-30T15:43:00"	"同所発"
"2020-11-30T15:45:00"	"官邸着"
"2020-11-30T16:22:00"	"環境省の中井徳太郎事務次官（～16:32）"
"2020-11-30T16:54:00"	"官邸発"
"2020-11-30T16:56:00"	"国会着"
"2020-11-30T16:57:00"	"国会内の自民党総裁室"
"2020-11-30T16:59:00"	"自民党役員会（～17:11）"
"2020-11-30T17:13:00"	"国会発"
"2020-11-30T17:15:00"	"官邸着"
"2020-11-30T17:41:00"	"農林水産物・食品の輸出拡大のための輸入国規制対応等に関する関係閣僚会議（～18:02）"
"2020-11-30T18:51:00"	"官邸発"
"2020-11-30T18:56:00"	"東京・紀尾井町のホテルニューオータニ着。同ホテル内の宴会場「LAPIS」で秘書官と食事、打ち合わせ | ○"
"2020-11-30T20:27:00"	"同ホテル発"
"2020-11-30T20:36:00"	"東京・赤坂の衆院議員宿舎着"
"2020-11-29T10:34:00"	"東京・赤坂の衆院議員宿舎発"
"2020-11-29T10:41:00"	"国会着"
"2020-11-29T10:42:00"	"参院議長室へ"
"2020-11-29T10:53:00"	"同室発"
"2020-11-29T10:54:00"	"参院本会議場へ"
"2020-11-29T11:02:00"	"議会開設130年記念式典（～11:21）"
"2020-11-29T11:22:00"	"参院本会議場出る"
"2020-11-29T11:23:00"	"国会発"
"2020-11-29T11:35:00"	"衆議院第2議員会館着"
"2020-11-29T11:38:00"	"加藤勝信官房長官と面会（～11:50）"
"2020-11-29T11:53:00"	"衆議院第2議員会館発"
"2020-11-29T11:57:00"	"東京・赤坂の衆議院宿舎着"
"2020-11-29T12:54:00"	"東京・赤坂の衆議院宿舎発"
"2020-11-29T12:59:00"	"東京・永田町のザ・キャピトルホテル東急着。同ホテル内のレストラン「ORIGAMI」で新浪剛史サントリーホールディングス社長と昼食 | ○"
"2020-11-29T14:00:00"	"岸博幸慶応大大学院教授と面会（～14:46）"
"2020-11-29T15:00:00"	"吉田正紀双日米国副社長、市川恵一外務省北米局長と面会（～15:56）"
"2020-11-29T16:00:00"	"リチャード・クー野村総合研究所主席研究員らと面会（～16:47）"
"2020-11-29T17:00:00"	"中国料理店「星ケ岡」で秘書官と夕食（～19:23） | ○"
"2020-11-29T19:24:00"	"東京・永田町のザ・キャピトルホテル東急発"
"2020-11-29T19:26:00"	"東京・赤坂の衆院議員宿舎着"
"2020-11-28T09:22:00"	"東京・赤坂の衆院議員宿舎発"
"2020-11-28T09:25:00"	"官邸着"
"2020-11-28T09:32:00"	"官邸発"
"2020-11-28T09:46:00"	"埼玉県狭山市の航空自衛隊入間基地着"
"2020-11-28T09:59:00"	"観閲式に出席、訓示（～10:17）"
"2020-11-28T11:05:00"	"オペレーションセンターや戦闘機など視察（～12:10）"
"2020-11-28T12:18:00"	"基地内の空輸ターミナルで岸信夫防衛大臣、防衛省の島田和久事務次官、芹沢清官房長、山崎幸二統合幕僚長、井筒俊司航空幕僚長らと昼食（～12:39） | ○"
"2020-11-28T13:05:00"	"埼玉県狭山市の航空自衛隊入間基地発"
"2020-11-28T13:18:00"	"官邸着"
"2020-11-28T13:59:00"	"官邸発"
"2020-11-28T14:01:00"	"東京・永田町のホテル「ザ・キャピトルホテル東急」着。ホテル内の中国料理店「星ケ岡」で、経済ジャーナリストの財部誠一氏と懇談"
"2020-11-28T14:49:00"	"同ホテル発"
"2020-11-28T14:58:00"	"東京・九段北のはりきゅうマッサージ店「グローバル治療院The Class九段」着。マッサージなど"
"2020-11-28T17:12:00"	"同店発"
"2020-11-28T17:26:00"	"東京・赤坂の衆院議員宿舎着"
"2020-11-27T06:42:00"	"東京・赤坂の衆院議員宿舎発"
"2020-11-27T06:45:00"	"官邸着　官邸の敷地内を散歩"
"2020-11-27T07:23:00"	"官邸発"
"2020-11-27T07:28:00"	"東京・虎ノ門のホテル「The Okura Tokyo」着　ホテル内のレストラン「オーキッド」で自民党の佐藤勉総務会長、園田修光参議院議員、柿崎明二総理大臣補佐官と食事 | ○"
"2020-11-27T08:13:00"	"同ホテル発"
"2020-11-27T08:19:00"	"官邸着"
"2020-11-27T08:25:00"	"閣議（～08:32）"
"2020-11-27T08:41:00"	"武田良太総務大臣、総務省の谷脇康彦審議官と面会（～08:51）"
"2020-11-27T10:00:00"	"藤井健志官房副長官補と面会（～10:09）"
"2020-11-27T10:19:00"	"農林水産省の枝元真徹事務次官、太田豊彦食料産業局長と面会（～10:34）"
"2020-11-27T10:35:00"	"竹本直一前IT担当大臣と面会（～10:40）"
"2020-11-27T10:49:00"	"北村滋国家安全保障局長、瀧澤裕昭内閣情報官、外務省の山田重夫総合外交政策局長、防衛省の岡真臣防衛政策局長、山崎幸二統合幕僚長が入った"
"2020-11-27T10:58:00"	"瀧澤内閣情報官、外務省の山田総合外交政策局長、防衛省の岡防衛政策局長、山崎統合幕僚長が出た"
"2020-11-27T10:59:00"	"北村国家安全保障局長が出た"
"2020-11-27T11:22:00"	"加藤勝信官房長官、和泉洋人総理大臣補佐官、経済産業省の新原浩朗経済産業政策局長と面会（～11:37）"
"2020-11-27T11:38:00"	"和泉総理大臣補佐官、内閣府の山崎重孝事務次官、田和宏内閣府審議官、林幸宏政策統括官、井上裕之政策統括官と面会（～11:46）"
"2020-11-27T11:54:00"	"官邸発"
"2020-11-27T11:57:00"	"東京・永田町のザ・キャピトルホテル東急着　ホテル内の中国料理店「星ヶ岡」で全国農業協同組合連合会（JA全農）の山崎周二代表理事理事長と食事 | ○"
"2020-11-27T12:49:00"	"同ホテル発"
"2020-11-27T12:51:00"	"官邸着"
"2020-11-27T14:00:00"	"防衛省の島田和久事務次官と面会（～14:05）"
"2020-11-27T14:10:00"	"自民党の「出入国在留管理業務の適性運用を支援する議員連盟」の柴山昌彦会長らから要望書受け取り（～14:20）"
"2020-11-27T14:21:00"	"自民党外国人労働者等特別委員会の片山さつき委員長らから提言書受け取り（～14:29）"
"2020-11-27T14:30:00"	"国際協力機構（JICA）の北岡伸一理事長と面会（～14:42）"
"2020-11-27T14:43:00"	"自民党の棚橋泰文行政改革推進本部長と面会（～14:55）"
"2020-11-27T15:05:00"	"赤羽一嘉国土交通大臣、加藤官房長官、西村経済再生担当大臣、藤井健志官房副長官補、吉田学新型コロナウイルス感染症対策推進室長と面会（～15:13）"
"2020-11-27T15:15:00"	"全国旅館ホテル生活衛生同業組合連合会の鈴木治彦青年部長らと面会　自民党の武井俊輔衆議院議員同席（～15:23）"
"2020-11-27T15:24:00"	"外務省の秋葉剛男事務次官と面会（～15:32）"
"2020-11-27T16:00:00"	"群馬県の山本一太知事と面会（～16:07）"
"2020-11-27T16:12:00"	"阿達雅志総理大臣補佐官と面会（～16:25）"
"2020-11-27T16:32:00"	"NTTの澤田純社長、NTTドコモの井伊基之次期社長と面会（～16:42）"
"2020-11-27T16:43:00"	"瀧澤内閣情報官と面会（～16:51）"
"2020-11-27T16:52:00"	"河野太郎規制改革担当大臣と面会（～17:04）"
"2020-11-27T17:15:00"	"経済財政諮問会議（～18:15）"
"2020-11-27T18:22:00"	"新型コロナウイルス感染症対策本部（～18:39）"
"2020-11-27T18:47:00"	"官邸発"
"2020-11-27T18:53:00"	"東京・虎ノ門のホテル「The Okura Tokyo」着　ホテル内の日本料理店「山里」で元プロ野球選手の江本孟紀氏、小早川毅彦氏らと会食 | ○"
"2020-11-27T20:36:00"	"同ホテル発"
"2020-11-27T20:46:00"	"衆院第二議員会館着"
"2020-11-27T21:13:00"	"同所発"
"2020-11-27T21:17:00"	"東京・赤坂の衆院議員宿舎着"
"2020-11-26T06:41:00"	"東京・赤坂の衆院議員宿舎発。"
"2020-11-26T06:43:00"	"官邸着。官邸の敷地内を散歩。"
"2020-11-26T07:25:00"	"官邸発"
"2020-11-26T07:27:00"	"東京・永田町のザ・キャピトルホテル東急着。同ホテル内のレストラン「ORIGAMI」で政治ジャーナリストの田崎史郎氏と会食。 | ○"
"2020-11-26T08:27:00"	"同ホテル発。"
"2020-11-26T08:29:00"	"衆院第２議員会館着"
"2020-11-26T09:01:00"	"同所発"
"2020-11-26T09:03:00"	"官邸着"
"2020-11-26T10:00:00"	"自民党女性活躍推進特別委員会の森雅子委員長らから提言書受け取り。（～10:06）"
"2020-11-26T10:07:00"	"麻生太郎副総理兼財務相、氷見野良三金融庁長官と面会。（～10:15）"
"2020-11-26T10:16:00"	"麻生副総理と面会（～10:23）"
"2020-11-26T10:30:00"	"自民党名古屋市会議員団の渡辺義郎団長ら。同党の熊田裕通、工藤彰三両衆院議員同席。（～10:46）"
"2020-11-26T10:47:00"	"石川正一郎拉致問題対策本部事務局長と面会（～11:01）"
"2020-11-26T11:02:00"	"田村憲久厚生労働大臣、和泉洋人首相補佐官、厚労省の坂口卓雇用環境・均等局長、渡辺由美子子ども家庭局長、浜谷浩樹保険局長、伊原和人政策統括官と面会。（～11:15）"
"2020-11-26T11:20:00"	"鈴木宗男日本維新の会参院議員と面会。（～11:30）"
"2020-11-26T11:50:00"	"官邸発"
"2020-11-26T11:58:00"	"東京・紀尾井町のホテルニューオータニ着。全国町村長大会に出席し、あいさつ。"
"2020-11-26T12:16:00"	"同ホテル発"
"2020-11-26T12:23:00"	"官邸着"
"2020-11-26T13:43:00"	"茂木敏充外務大臣と面会（～14:02）"
"2020-11-26T14:10:00"	"麻生副総理兼財務大臣、財務省の太田充事務次官、矢野康治主計局長、大鹿行宏理財局長と面会（～14:28）"
"2020-11-26T14:29:00"	"麻生副総理兼財務大臣（～14:31）"
"2020-11-26T14:52:00"	"梶村充自民党横浜市議（～15:07）"
"2020-11-26T15:10:00"	"全国商工会連合会の森義久会長らと面会。宮本周司同党参院議員同席。（～15:20）"
"2020-11-26T16:35:00"	"サウジアラビアのムハンマド・ビン・サルマン皇太子と電話会談。（～16:45）"
"2020-11-26T17:03:00"	"田村厚労大臣、赤羽一嘉国土交通大臣、加藤勝信官房長官、西村康稔経済再生担当大臣、藤井健志官房副長官補、吉田学新型コロナウイルス感染症対策推進室長と面会（～17:49）"
"2020-11-26T18:44:00"	"報道各社インタビュー（～18:46）"
"2020-11-26T18:47:00"	"官邸発"
"2020-11-26T18:50:00"	"東京・永田町のザ・キャピトルホテル東急着。同ホテル内のレストラン「ORIGAMI」で秘書官と夕食 | ○"
"2020-11-26T20:01:00"	"同ホテル発"
"2020-11-26T20:02:00"	"衆議院第２議員会館着"
"2020-11-26T20:23:00"	"同所発"
"2020-11-26T20:29:00"	"東京・赤坂の衆議院宿舎着"
"2020-11-25T05:52:00"	"東京・赤坂の衆議院議員宿舎発"
"2020-11-25T05:56:00"	"官邸着"
"2020-11-25T06:00:00"	"坂井学官房副長官と面会"
"2020-11-25T06:21:00"	"岡田直樹官房副長官が加わる"
"2020-11-25T06:40:00"	"坂井、岡田両副長官が出る"
"2020-11-25T08:43:00"	"官邸発"
"2020-11-25T08:45:00"	"国会着"
"2020-11-25T08:47:00"	"衆議院第１委員室に入る"
"2020-11-25T09:09:00"	"衆議院予算委員会開会"
"2020-11-25T12:15:00"	"衆議院予算委員会散会"
"2020-11-25T12:16:00"	"衆議院第１委員室を出る"
"2020-11-25T12:19:00"	"国会発"
"2020-11-25T12:21:00"	"官邸着"
"2020-11-25T12:22:00"	"中国経済連合会の苅田知英会長らと写真撮影（～12:23）"
"2020-11-25T12:47:00"	"官邸発"
"2020-11-25T12:49:00"	"国会着"
"2020-11-25T12:52:00"	"参議院第１委員会室に入る"
"2020-11-25T13:18:00"	"参議院予算委員会開会"
"2020-11-25T16:27:00"	"参議院予算委員会散会"
"2020-11-25T16:28:00"	"参議院第１委員会室を出る"
"2020-11-25T16:30:00"	"国会発"
"2020-11-25T16:32:00"	"官邸着"
"2020-11-25T17:02:00"	"中国の王毅外相の表敬（～17:24）"
"2020-11-25T17:27:00"	"月例経済報告関係閣僚会議（～17:39）"
"2020-11-25T18:31:00"	"官邸発"
"2020-11-25T18:36:00"	"東京・虎ノ門のホテル「The Okura Tokyo」着　ホテル内のレストラン「オーキッド」で自民党の城内実、石川昭政両衆議院議員と会食 | ●"
"2020-11-25T19:40:00"	"同ホテル発"
"2020-11-25T19:49:00"	"衆議院第二議員会館着"
"2020-11-25T20:10:00"	"同所発"
"2020-11-25T20:14:00"	"東京・赤坂の衆議院議員宿舎着"
"2020-11-24T06:39:00"	"東京・赤坂の衆議院議員宿舎発"
"2020-11-24T06:43:00"	"官邸着、敷地内を散歩"
"2020-11-24T07:22:00"	"官邸発"
"2020-11-24T07:26:00"	"東京・虎ノ門のホテル「The Okura Tokyo」着、ホテル内のレストラン「オーキッド」でスズキの鈴木修会長、自民党の大岡敏孝衆議院議員と朝食、打ち合わせ | ○"
"2020-11-24T08:07:00"	"同ホテル発"
"2020-11-24T08:12:00"	"官邸着、敷地内を散歩"
"2020-11-24T08:22:00"	"閣議(～8:34)"
"2020-11-24T08:35:00"	"茂木敏充外務大臣と面会(～8:38)"
"2020-11-24T08:48:00"	"田村憲久厚生労働大臣、赤羽一嘉国土交通大臣、加藤勝信官房長官、西村康稔経済再生担当大臣、藤井健志官房副長官補、吉田学新型コロナウイルス感染症対策推進室長と面会(～9:26)"
"2020-11-24T10:51:00"	"北村滋国家安全保障局長と面会(～10:56)"
"2020-11-24T11:18:00"	"自民党神奈川県連の土井隆典幹事長らと面会、坂井学官房副長官、自民党の島村大参議院議員が同席(～11:28)"
"2020-11-24T11:29:00"	"西村経済再生担当大臣、内閣府の山崎重孝事務次官、田和宏内閣府審議官、林幸宏政策統括官、籠宮信雄政策統括官と面会(～11:40)"
"2020-11-24T11:41:00"	"西村経済再生担当大臣と面会(～11:46)"
"2020-11-24T14:00:00"	"富山県の新田八朗知事と面会、野上浩太郎農林水産大臣、自民党の山口泰明選挙対策委員長ら同席(～14:09)"
"2020-11-24T14:13:00"	"平井卓也デジタル改革担当大臣、藤井官房副長官補と面会(～14:25)"
"2020-11-24T14:30:00"	"公明党の竹内譲政策調査会長らから第3次補正予算についての提言書受け取り(～14:40)"
"2020-11-24T14:47:00"	"中谷元自民党中央政治大学院長と面会(～14:57)"
"2020-11-24T14:58:00"	"東京都の小池百合子知事と面会(～15:12)"
"2020-11-24T16:25:00"	"梶山弘志経済産業大臣、経済産業省の安藤久佳事務次官、荒井勝善総括審議官と面会(～16:47)"
"2020-11-24T16:48:00"	"北村国家安全保障局長、瀧澤裕昭内閣情報官と面会(～16:57)"
"2020-11-24T17:17:00"	"全世代型社会保障検討会議(～18:12)"
"2020-11-24T18:21:00"	"田村厚生労働大臣、赤羽国土交通大臣、加藤官房長官、西村経済再生担当大臣、藤井官房副長官補、吉田新型コロナウイルス感染症対策推進室長と面会(～19:14)"
"2020-11-24T19:57:00"	"官邸発"
"2020-11-24T20:01:00"	"東京・赤坂の衆議院議員宿舎着"
"2020-11-23T08:51:00"	"東京・赤坂の衆院議員宿舎発"
"2020-11-23T08:59:00"	"東京・二番町の住友不動産麹町ビル着　「G1経営者会議」に出席し、講演、討論"
"2020-11-23T09:58:00"	"同所発"
"2020-11-23T10:10:00"	"衆院第二議員会館着"
"2020-11-23T12:01:00"	"同所発"
"2020-11-23T12:03:00"	"東京・永田町のザ・キャピトルホテル東急着　ホテル内の中国料理店「星ヶ岡」で秘書官と食事 | ○"
"2020-11-23T12:48:00"	"同ホテル発"
"2020-11-23T12:52:00"	"自民党本部着　関東８都県の同党都県連役員とテレビ電話で意見交換"
"2020-11-23T14:44:00"	"同所発"
"2020-11-23T14:47:00"	"衆院第二議員会館着"
"2020-11-23T15:14:00"	"同所発"
"2020-11-23T15:19:00"	"東京・赤坂の衆院議員宿舎着"
"2020-11-23T17:23:00"	"同議員宿舎発"
"2020-11-23T17:33:00"	"皇居着　新嘗祭神嘉殿の儀に参列"
"2020-11-23T19:58:00"	"皇居発"
"2020-11-23T20:09:00"	"東京・赤坂の衆院議員宿舎着"
"2020-11-22T11:25:00"	"東京・赤坂の衆議院議員宿舎発"
"2020-11-22T11:31:00"	"東京・永田町の「ザ・キャピトルホテル東急」着　ホテル内のスパ＆バーバー「カージュラジャ　ティアド」で散髪　「ザ・キャピトル　フィットネスクラブ」で運動"
"2020-11-22T15:32:00"	"同所発"
"2020-11-22T15:36:00"	"東京・赤坂の衆議院議員宿舎着"
"2020-11-22T17:53:00"	"同所発"
"2020-11-22T18:00:00"	"東京・紀尾井町の「ホテルニューオータニ」　ホテル内の宴会場「AKEBONO」で秘書官と食事、打ち合わせ | ○"
"2020-11-22T19:50:00"	"同所発"
"2020-11-22T19:56:00"	"東京・赤坂の衆議院議員宿舎着"
"2020-11-22T22:59:00"	"同所発"
"2020-11-22T23:02:00"	"官邸着"
"2020-11-22T22:22:00"	"G20サミット＝主要20か国の首脳会議にオンラインで出席"
"2020-11-22T23:42:00"	"G20首脳会議を途中退席"
"2020-11-22T23:43:00"	"官邸発"
"2020-11-22T23:49:00"	"東京・赤坂の衆院議員宿舎着"
"2020-11-21T12:20:00"	"東京・赤坂の衆議院議員宿舎発"
"2020-11-21T12:24:00"	"官邸着"
"2020-11-21T12:37:00"	"赤羽一嘉国土交通大臣と面会(～12:59)"
"2020-11-21T12:59:00"	"加藤勝信官房長官、赤羽国土交通大臣、西村康稔経済再生担当大臣と面会(～13:21)"
"2020-11-21T13:21:00"	"加藤官房長官、赤羽国土交通大臣、西村経済再生担当大臣、田村憲久厚生労働大臣と面会(～13:50)"
"2020-11-21T13:50:00"	"加藤官房長官、赤羽国土交通大臣と面会(～14:05）"
"2020-11-21T15:26:00"	"田村厚生労働大臣、赤羽国土交通大臣と面会(～15:43)"
"2020-11-21T15:43:00"	"田村厚生労働大臣、赤羽国土交通大臣、西村経済再生担当大臣と面会(～15:57)"
"2020-11-21T16:04:00"	"新型コロナウイルス感染症対策本部(～16:21)"
"2020-11-21T17:18:00"	"報道各社のインタビュー(～17:20)"
"2020-11-21T18:00:00"	"官邸発"
"2020-11-21T18:04:00"	"東京・赤坂の「ANAインターコンチネンタルホテル東京」着、ホテル内の中国料理店「花梨」で秘書官と夕食、打ち合わせ | ●"
"2020-11-21T19:13:00"	"同ホテル発"
"2020-11-21T19:20:00"	"官邸着"
"2020-11-21T22:00:00"	"G20サミット＝主要20か国の首脳会議にオンライン形式で出席(～22:53)"
"2020-11-21T22:58:00"	"官邸発"
"2020-11-21T23:03:00"	"東京・赤坂の衆議院議員宿舎着"
"2020-11-20T06:44:00"	"東京・赤坂の衆議院赤坂議員宿舎発"
"2020-11-20T06:46:00"	"官邸着　敷地内を散歩"
"2020-11-20T08:21:00"	"閣議(～8:32)"
"2020-11-20T08:37:00"	"農林水産物・食品の輸出拡大のための輸入国政への対応等に関する関係閣僚会議(～9:06)"
"2020-11-20T09:46:00"	"官邸発"
"2020-11-20T09:48:00"	"国会着"
"2020-11-20T10:01:00"	"参議院本会議"
"2020-11-20T11:53:00"	"国会発"
"2020-11-20T11:59:00"	"東京・紀尾井町の「ホテルニューオータニ」着　ホテル内の中国料理店「大観苑」で沖縄経済懇談会の安慶田光男代表理事、かりゆしグループの平良朝敬オーナー会長らと会食 | 〇"
"2020-11-20T12:38:00"	"同所発"
"2020-11-20T12:45:00"	"官邸着"
"2020-11-20T14:05:00"	"加藤勝信官房長官、西村経済再生担当大臣と面会"
"2020-11-20T14:31:00"	"井上信治科学技術担当大臣、和泉洋人総理大臣補佐官、葛西敬之宇宙政策委員会委員長、松尾剛彦内閣府宇宙開発戦略推進事務局長と面会"
"2020-11-20T14:45:00"	"笹川堯全日本空手道連盟会長らと面会。"
"2020-11-20T15:05:00"	"麻生太郎副総理兼財務大臣、財務省の太田充事務次官、矢野康治主計局長と面会"
"2020-11-20T16:00:00"	"ニュージーランドのアーダーン首相と電話会談(～16:17)"
"2020-11-20T17:30:00"	"加藤官房長官、田村憲久厚生労働大臣、西村経済再生担当大臣、藤井健志官房副長官補、和泉総理大臣補佐官、厚生労働省の樽見英樹事務次官、福島靖正医務技官、吉田学新型コロナウイルス感染症対策推進室長、と面会"
"2020-11-20T18:00:00"	"全国都道府県知事会議(～18:32)"
"2020-11-20T19:03:00"	"官邸発"
"2020-11-20T19:10:00"	"東京・紀尾井町の「ホテルニューオータニ」着　ホテル内の「ガーデンコートクラブ」で小此木八郎国家公安委員長らと会食 | 〇"
"2020-11-20T20:13:00"	"同所発"
"2020-11-20T20:17:00"	"衆議院第二議員会館着"
"2020-11-20T20:34:00"	"同所発"
"2020-11-20T20:37:00"	"官邸着"
"2020-11-20T21:51:00"	"APEC＝アジア太平洋経済協力会議の首脳会議にテレビ会議で参加"
"2020-11-20T22:25:00"	"官邸発"
"2020-11-20T22:32:00"	"東京・赤坂の衆議院赤坂議員宿舎着"
"2020-11-19T06:41:00"	"東京・赤坂の衆院議員宿舎発"
"2020-11-19T06:45:00"	"官邸着、敷地内を散歩"
"2020-11-19T07:24:00"	"官邸発"
"2020-11-19T07:27:00"	"東京・永田町のホテル「ザ・キャピトルホテル東急」着。ホテル内のレストラン「ＯＲＩＧＡＭＩ」で、金丸恭文フューチャー会長兼社長と会食 | ○"
"2020-11-19T08:16:00"	"同ホテル発"
"2020-11-19T08:18:00"	"官邸着"
"2020-11-19T08:34:00"	"政務官会議の出席者と写真撮影（～８：４０）"
"2020-11-19T09:11:00"	"報道各社のインタビュー（～９：１３）"
"2020-11-19T09:14:00"	"官邸発"
"2020-11-19T09:16:00"	"東京・永田町のホテル「ザ・キャピトルホテル東急」着。ホテル内のレストラン「ＯＲＩＧＡＭＩ」で、ジャーナリストの田原総一朗氏と懇談"
"2020-11-19T09:50:00"	"同ホテル発"
"2020-11-19T09:58:00"	"東京・紀尾井町のホテルニューオータニ着。同ホテル内の宴会場「芙蓉の間」で自民党東京都連の会合に出席し、あいさつ。都議選立候補予定者と写真撮影"
"2020-11-19T10:25:00"	"同ホテル発"
"2020-11-19T10:32:00"	"官邸着"
"2020-11-19T10:57:00"	"世界気候サミットなどに向けたビデオメッセージの収録（～１１：１４）"
"2020-11-19T11:28:00"	"自民党の母子寡婦福祉対策議員連盟の永岡桂子会長ら（～１１：３８）"
"2020-11-19T12:21:00"	"公明党の山口那津男代表と昼食（～１２：５０） | ○"
"2020-11-19T13:08:00"	"官邸発"
"2020-11-19T13:10:00"	"国会着"
"2020-11-19T13:11:00"	"衆院本会議場へ移動し、衆院本会議に途中出席"
"2020-11-19T13:35:00"	"衆院本会議散会"
"2020-11-19T13:37:00"	"国会発"
"2020-11-19T13:39:00"	"官邸着"
"2020-11-19T13:59:00"	"坂井学官房副長官、岡田直樹官房副長官、北村滋国家安全保障局長、和泉洋人首相補佐官、外務省の鈴木浩外務審議官、財務省の岡村健司財務官、厚生労働省の福島靖正医務技監、経済産業省の田中繁広経済産業審議官、環境省の近藤智洋地球環境審議官（～１４：１２）"
"2020-11-19T14:23:00"	"農林水産省の枝元真徹事務次官（～１４：３３）"
"2020-11-19T14:35:00"	"自民党の世耕弘成参院幹事長（～１４：４５）"
"2020-11-19T16:03:00"	"日本歯科医師会の堀憲郎会長（～１６：１３）"
"2020-11-19T16:52:00"	"坂本哲志少子化対策担当大臣、内閣府の嶋田裕光子ども・子育て本部統括官、財務省の矢野康治主計局長、厚生労働省の渡辺由美子子ども家庭局長、伊原和人政策統括官（～１７：０７）"
"2020-11-19T17:16:00"	"田村憲久厚労大臣、西村康稔経済再生担当大臣、藤井健志官房副長官補、和泉首相補佐官、吉田学新型コロナウイルス感染症対策推進室長、厚生労働省の樽見英樹事務次官、福島医務技監（～１７：５１）"
"2020-11-19T17:52:00"	"国家安全保障会議（～１８：１８）"
"2020-11-19T18:38:00"	"官邸発"
"2020-11-19T18:43:00"	"東京・永田町のホテル「ザ・キャピトルホテル東急」着。ホテル内のレストラン「ＯＲＩＧＡＭＩ」で、自民党の三谷英弘衆院議員、木村哲也衆院議員と夕食 | ○"
"2020-11-19T20:07:00"	"同ホテル発"
"2020-11-19T20:09:00"	"衆院第２議員会館着"
